{
  "id": "evt_20260701_df3efaa5",
  "type": "limits.changed",
  "provider": "anthropic",
  "model_id": "claude-sonnet-4-5",
  "observed_at": "2026-07-01T08:41:19Z",
  "effective_at": null,
  "summary": "Anthropic tier-2 TPM limit for claude-sonnet-4-5 doubled from 450k to 900k.",
  "data": {
    "limit_kind": "tpm",
    "tier": "tier-2",
    "old": 450000,
    "new": 900000
  },
  "evidence": [
    {
      "source_id": "anthropic-docs-rate-limits",
      "url": "https://docs.anthropic.com/en/api/rate-limits",
      "fetched_at": "2026-07-01T08:41:19Z",
      "sha256_full": "3dfa0c5582798ae9140359dbbd0c58ab418e10091e62052feccac08de7b7e3f0",
      "sha256_stored": null,
      "truncation_rule": "css:table.rate-limits",
      "excerpt": null,
      "manifest_path": "manifests/evidence/anthropic-docs-rate-limits/2026-07-01T08-41-19Z.meta.json",
      "archive_path": "anthropic-docs-rate-limits/2026-07-01T08-41-19Z.bin",
      "http_status": 200,
      "etag": null
    }
  ],
  "producer": {
    "collector_id": "collector.docs-html",
    "code_sha": "3f9c2ab7d4e1f8a0b6c5d4e3f2a1b0c9d8e7f6a5",
    "schema_version": "2.0.0"
  },
  "correction_of": null
}
