{
  "id": "evt_20260701_78325a55",
  "type": "model.retired",
  "provider": "anthropic",
  "model_id": "claude-2.1",
  "observed_at": "2026-07-01T09:15:40Z",
  "effective_at": "2026-07-21T00:00:00Z",
  "summary": "Anthropic deprecation docs set claude-2.1 shutdown for 2026-07-21; requests will be rejected after that date.",
  "data": {
    "eol_date": "2026-01-21",
    "shutdown_date": "2026-07-21",
    "replacement_model": "claude-sonnet-4-5",
    "source_kind": "docs"
  },
  "evidence": [
    {
      "source_id": "anthropic-docs-deprecations",
      "url": "https://docs.anthropic.com/en/docs/about-claude/model-deprecations",
      "fetched_at": "2026-07-01T09:15:40Z",
      "sha256_full": "c6701687133a8df024f09cea8de231b785f4a79a8c265f87b4c69d6073a6f113",
      "sha256_stored": null,
      "truncation_rule": "css:table.deprecations",
      "excerpt": "claude-2.1 — retirement date: July 21, 2026",
      "manifest_path": "manifests/evidence/anthropic-docs-deprecations/2026-07-01T09-15-40Z.meta.json",
      "archive_path": "anthropic-docs-deprecations/2026-07-01T09-15-40Z.bin",
      "http_status": 200,
      "etag": null
    }
  ],
  "producer": {
    "collector_id": "collector.docs-html",
    "code_sha": "3f9c2ab7d4e1f8a0b6c5d4e3f2a1b0c9d8e7f6a5",
    "schema_version": "2.0.0"
  },
  "correction_of": null
}
