{
  "id": "evt_20260701_dce7f769",
  "type": "outage.started",
  "provider": "openai",
  "model_id": null,
  "observed_at": "2026-07-01T13:22:08Z",
  "effective_at": null,
  "summary": "OpenAI status page opened incident 01j9zkx8q2: elevated error rates on the API (major).",
  "data": {
    "incident_id": "01j9zkx8q2",
    "components": [
      "API",
      "Chat Completions"
    ],
    "provider_status_url": "https://status.openai.com/incidents/01j9zkx8q2",
    "severity_reported": "major"
  },
  "evidence": [
    {
      "source_id": "openai-statuspage",
      "url": "https://status.openai.com/api/v2/incidents.json",
      "fetched_at": "2026-07-01T13:22:08Z",
      "sha256_full": "2c9ff5fc27d20716e73963c27acbc8af01b01d3e45daf9fbef1fb41ab5edeb09",
      "sha256_stored": null,
      "truncation_rule": null,
      "excerpt": null,
      "manifest_path": "manifests/evidence/openai-statuspage/2026-07-01T13-22-08Z.meta.json",
      "archive_path": "openai-statuspage/2026-07-01T13-22-08Z.bin",
      "http_status": 200,
      "etag": null
    }
  ],
  "producer": {
    "collector_id": "collector.statuspage",
    "code_sha": "3f9c2ab7d4e1f8a0b6c5d4e3f2a1b0c9d8e7f6a5",
    "schema_version": "2.0.0"
  },
  "correction_of": null
}
